{"schema_version":1,"consent_id":"consent_demo_001","guardian_id":"guardian_demo_001","child_id":"child_demo_001","text_version":"consent_v1_2026-10","attestation":"I am the parent or guardian of Demo, aged 8. I agree that Alo.ai can record my child reading aloud, use the recording to make their reading report, and keep the audio for up to 90 days. Alo.ai is a screening tool that helps us practise reading.","sign_in_method":"email_code","verified_email":"guardian@example.com","timestamp":"2026-01-15T08:55:00Z","training_opt_in":false}
